id,brewery_id,name,cat_id,style_id,style_id_II,abv,descript
5202,384,Climax Extra Special Bitter Ale,1,5,Extra Special Bitter,5.5,"Our E.S.B. is a balanced beer with notes of honey, toffee and caramel, backed by a warm spicy hop bitterness."
5203,384,Climax Nut Brown Ale,3,38,American-Style Brown Ale,5.199999809,"This style of beer is based on the English Mild, which was a combination of a stout and a lighter beer favored by coal miners in Scotland, Ireland and North England.
We've brought together the grains used to make both a Stout and a Pale Ale and balanced them in our Nut Brown Ale to produce a beer with a chocolate and molasses flavor and hints of caramel and coffee in the background."
5204,384,Climax Cream Ale,11,113,American-Style Cream Ale or Lager,0,"Our Cream Ale is a light, crisp, yellow ale with hop-notes and citrus flavors. It's a smooth, easy drinking summer beer that's perfect for drinking on hot days and with light fare such as seafood and salads."
5205,384,Climax Barleywine-Style Ale,3,35,American-Style Barley Wine Ale,10,"Brewed for our 10th Anniversary, the Barleywine is a bottle conditioned ale that's meant to be laid down and enjoyed for years to come. Up front it has a hop nose and hop flavor on the tongue that fades into malty overtones with flavors of vanilla that go into chocolate. As it has aged, we've noticed flavors of dates and raisins as well."
5206,384,Climax Helles,7,91,German-Style Heller Bock/Maibock,4.800000191,"The Hoffmann Helles (pronounced Hell-es), which is German for ""bright"" is a pleasant and easy to drink summer beer with a bready/grainy taste."
5207,384,Climax Oktoberfest,7,84,German-Style Oktoberfest,6.199999809,"Oktoberfest is typically available from August to November and has toasty caramel and malty flavor.  It is made from German Noble Hops and massive amounts of Munich Malt, which give it an orange color."
5208,384,Climax Doppel Bock,7,92,German-Style Doppelbock,8,Traditionally brewed by Monks to sustain them while they fasted during lent; the Doppel Bock is a big-bodied and flavorful beer.
5209,384,Climax Wheat Ale,11,116,Light American Wheat Ale or Lager,5,"Hoffmann Hefeweizen is our newest offering and is a traditional German wheat beer made from 60% wheat malt and 40% barley malt. Wheat Ales such as this typically have banana and clove flavors but as Dave dislikes clove, he used a special yeast to strengthen the banana flavors. Hefeweizen is a nice, light, crisp summer beer that can be served with lemon or flavored syrups."
5210,956,Mama's Little Yella Pils,7,77,German-Style Pilsener,5.300000191,"Mama's Little Yella Pils - Our upcoming new canned good is a small-batch version of the beer that made Pilsen, Czechoslovakia famous. Mama's is made with hearty amounts of pale malt, German specialty malts, and a blend of traditional (Saaz) and 21st century Bavarian hops. Our first canned lager, it's also fermented at cool temperatures with a German yeast.

This tasteful reality Czech is the perfect antidote for the watered-down versions of pilsner clogging America's shelves. And Mama's gentle hopping (about 35 IBUs) and low ABV (just 5.3%) mean we're finally honoring consumer requests for a delicious but less-challenging beer. (Hey, we like a good low-dose session beer, too.) Look for our Gold Metal Winner on US shelves in March.

Sadly, the Feds rejected our 'Take Two and Call Us in the Morning' line on the can."
5213,1182,Beyond The Gates Double IPA,3,32,Imperial or Double India Pale Ale,7.5,"This beer is for those of you who have been enjoying Seven Gates Pale Ale, and are ready for that next step. Beyond the Gates Double IPA is a highly hopped brew featuring plenty of Cascade and Columbus hops. These varieties give Beyond the Gates a floral citrus aroma, and pack plenty of hopped up flavor into this full-bodied ale, which is coming in @ 7.5 ABV. Let us take you Beyond the Gates, and you'll never look back!"
5214,771,Baltic Porter,2,25,Porter,7.5,"A traditional lager-style beer, with its dark color and medium body, has a defined hop flavor balanced by the smoothness of extra special roasted malt. This healthy dose of over six malt flavors makes this beer perfect for the transition from winter into spring."
5215,771,Shoo-Fly Porter,2,25,Porter,6,"Lancaster Brewing Company's newest release is their limited series of Shoo-Fly Porter. From the heart of Pennsylvania Dutch Country comes a delicious porter made with Lancaster County molasses, eight different malts and grains, and four different styles of hops. This beer has a deep, rich, brown color, medium to full body, and finishes with a smooth mouth feel."
5217,1211,Market Alley,3,33,American-Style Amber/Red Ale,0,Made exclusively for the Lancaster Dispensing Company.
5220,858,Rondy Brew 2009,3,26,American-Style Pale Ale,4.5,"RondyBrew 2009 is a rendezvous of playful pale malts and feisty American hops, designed to exhilarate your winter-weary soul. This copper-colored ale delivers citrusy and refreshing hop aroma and flavor.

This year's label features Rondy's hottest event: The Running of the Reindeer. If you're suffering from cabin fever, get out and run with the herd. But ready, set, RUN because this beer is only available for a limited time.

RondyBrew adds refreshment and celebration to the festive fare and entertaining events enjoyed during Anchorage's Fur Rondy Festival."
5221,858,Oak-Aged Imperial Chocolate Pumpkin Porter,2,25,Porter,7.800000191,This version is even lovelier than the original. Share with your sweetie.
5224,44,Michelob Hop Hound Amber Wheat,11,116,Light American Wheat Ale or Lager,5.300000191,Unfiltered American amber wheat ale brewed with a blend of imported and domestic hops for a balanced slightly citrus hop aroma and caramel malty taste.
5225,1089,Haywords 5000,8,95,American-Style Lager,7.5,"Launched in the year 1983, Haywards 5000 is synonymous with strong beer in India. Haywards 5000 is brewed with the choicest of malts and hops lending itself to a unique flavour profile to suit the Indian taste and preference. Haywards 5000 is the hallmark of original and authentic strong beer which other beer brands aspire for. With such credentials, it is not surprising to see men get together over Haywards 5000. It is the language of friendship amongst men who are proud of their masculinity and look forward to a great time with their friends and peers .

http://www.sabmiller.in/brands_haywards_5000.html"
5227,1055,Richbrau Abbey-Style Ale,5,72,Other Belgian-Style Ales,7,This recipe is meant to replicate a Belgian Abbey-style ale. Tart from the Belgian yeast but malty and sweet from the addition of rock candy sugar. Reddish brown in color.
5228,1055,Richbrau Oatmeal Stout,1,21,Oatmeal Stout,5.199999809,"If you don't do dark beers, do yourself a favor and cancel that policy for this Oatmeal Stout. Keywords: Sweet Lusciousness; Roasty chocolate. Served on a nitro tap."
5229,1055,Santa's Little Helper Witbier,5,67,Belgian-Style White,5.699999809,"We brewed this pleasantly aromatic wheat beer with the addition of bitter orange peel, coriander and a Belgian Abbey ale yeast strain. This beer is unfiltered and its flavor is tart but sweet and perfumey."
5230,1055,Richbrau Barleywine,3,35,American-Style Barley Wine Ale,12.30000019,"Malty, rich, complex with a notable hops balance. Aged for 90 days. For optimal taste allow the beer to warm on your table or from the heat of your hand around the glass. 1/2 pints only. 12.3 abv! Offered downstairs at the Taphouse or Pub Bar/ Dining Room only."
5231,1055,Richbrau India Pale Ale,3,31,American-Style India Pale Ale,6.199999809,"A hops showcase in aroma, flavor and bitterness. We used the delightful Amarillo hop as the most prominent choice."
5232,1055,Big Nasty Porter,2,25,Porter,6.400000095,This dark brown porter has more bark than bite. It is actually fairly sweet and fruity with a nutty/chocolate flavor as well. Highly recommended.
5233,1055,Old Nick Pale Ale,3,26,American-Style Pale Ale,5.5,"Our pale ale is located toward the lighter side of the beer spectrum and we hope it will serve as a stepping stone into the more flavorful world of craft beer. Amber, caramel, fruity, hoppy and bitter."
5234,1055,Griffin Golden Ale,3,37,Golden or Blonde Ale,5.199999809,"Our lightest and palest signature brew, the Griffin is our house session beer. Notice the spicy character imparted by the German hops we use in the Griffin."
5235,876,Apache Trout Stout,1,20,Sweet Stout,5,"From Arizona's high country comes Apache Trout Stout, a robust, full bodied, top fermented ale.  Our brewers use mountain pure water, select roasted barley, hops and yeast to create this traditional style.  Savor the balanced, roasted malt flavor and the lingering sweetness that makes this dry stout a cool weather treat."
5236,876,Wapiti Amber Ale,3,33,American-Style Amber/Red Ale,5,"This is our flagship ale.  The label for this beer is adorned with the majestic Wapiti (aka elk).  Wapiti are abundant in northern Arizona.  They are large and beautiful creatures, which is why we chose this animal to represent this beer.  Wapiti Amber Ale is hand crafted with mountain pure water, two row malted barley, yeast and Yakima Valley hops.  Our brewers use traditional methods to create this full-bodied amber ale with a distinct hoppy aroma.  Wapiti Amber Ale should be enjoyed cool, not cold, to best experience the complex character and flowery aroma.  Serve at 43-47 deg F."
5237,876,Superstition Pale Ale,3,26,American-Style Pale Ale,5,"If you are searching for a light, refreshing pale ale, your search is over!  Superstition Pale Ale is named after the Superstition Mountains which are just east of Phoenix.  This American pale ale is brewed using mountain pure water, select domestic grain, yeast and hops from the Pacific Northwest.  Superstition is copper in color with a clean, malty fullness and finishes with pronounced hop bitterness.  Perfect for enjoying on a warm Arizona day."
5238,876,Heffevonom Bavarian Wheat,4,50,South German-Style Hefeweizen,0,"A truly delicious beer, Heffevenom is a medium bodied, lightly hopped wheat beer brewed in the true Bavarian tradition.  Our brewers combine mountain pure water, select wheat and domestic malted grain, hops and yeast to create a highly refreshing ale with a pronounced banana and clove bouquet. Perfect with a slice of lemon as garnish."
5239,876,Horny Toad IPA,3,31,American-Style India Pale Ale,7.099999905,"If you like big, bold, pronounced hop character, then this beer is for you.  One taste and you'll find yourself right smack in the middle of Hop Head Heaven!  But this beer has more to offer than just hops.  We use tons of the finest malted barley available to balance out this beer.  The result of our efforts is a beer with a magnitude of hop aroma and bite, yet perfectly balanced with a clean, crisp malty flavor.  WARNING: This beer is not intended for the masses that prefer a mild domestic beer,  It's big, bold characteristics and 7.1% a.b.v. are not intended for the weak."
5240,787,Farm Girl Saison,5,74,French & Belgian-Style Saison,6,"This pale golden, Belgian-influenced ale is for everyone: Farm Girl, wannabe Farm Girl. In the Belgian Farmhouse tradition, this brew has a dry malt finish and a spiciness that only Belgian yeasts can create. Smooth and well rounded... this one can please anyone in any situation, whether you are on the water, in the sun, or hiding from winter's chill."
5241,787,Lift Bridge Pale Ale,3,26,American-Style Pale Ale,5.5,Well balanced amber pale ale accentuated by multiple additions of floral Cascade hops and our unique introduction of grapefruit zest to compliment the citrus notes of the hops.
5242,787,Biscotti,5,66,Belgian-Style Dark Strong Ale,7,"We drew inspiration from Steve's Grandmother's holiday biscotti recipe to create this one of a kind brew. By utilizing an array of malts, oats, wheat, pure local honey, light European hops and delicately spicing with Grains of Paradise, Madagascar vanilla beans, whole star anise, all brought together with traditional Belgian yeast, the result is a cloudy, deep copper colored, complex experience. This delight to the senses should be served in a 12 ounce footed glass and allowed to warm to 50 degrees to fully gather the malt and spice spectrum."
5243,787,Harvestor Fresh Hop Ale,3,26,American-Style Pale Ale,7.199999809,Constant addition of fresh Cascade and Willamette hops from Brad's Stillwater hop garden during boil and fermentation process. Aromatic and caramel malts compliment the hop character for an incredibly balanced beer that celebrates the hop harvest without killing your tongue.
5245,462,Double Mountain Pale Ale,3,26,American-Style Pale Ale,5.099999905,"It's easy to forget just how dynamite a well-made pale ale can treat you. Our Pale combines softness from our Pilsner malt,  a touch of sweetness from English crystal malt, and plenty of fruity, resinous Northwest hop flavor. The finish is dry, clean and refreshing."
5246,462,"India Red Ale (The ""IRA"")",3,31,American-Style India Pale Ale,6.800000191,"The 'IRA', as it's known around here, marries a ruby red color and rich body with the hop flavors of an IPA. Our unique ale yeast strain adds a delicious layer of complexity. One of the first beers we made, and an enduring favorite."
5247,462,Hop Lava,3,31,American-Style India Pale Ale,7,"This big, glowing, powerful IPA is packed with assertive Northwest hops that are floral, citrusy and resinous. A healthy dose of Munich malt helps to provide backbone and balance against the hoppy attack. The result? Explosive!"
5248,462,Double Mountain Altbier,4,57,German-Style Brown Ale/Altbier,5.599999905,"This special German-style ale is still made faithfully in Dusseldorf, just down the road from Cologne. Our interpretation is light brown in color and cleanly malty, with a crisp hoppy bitterness in the finish. 
Brewed with organic Pilsner and Munich malt; Chocolate and wheat malt, and imported Spalt hops."
5249,1388,Yuengling Bock Beer,7,90,Traditional German-Style Bock,0,"In celebration of our 180th Anniversary year, the marketplace will see one of the first seasonal offerings from the Yuengling Brewery in many years. Yuengling has produced a Bock Beer in its long and storied past, and we have now reinvented that product for limited release in 2009. The new brew is dark brown in color and offers exceptional flavor that lives up to the quality Yuengling drinkers have grown to expect.

Yuengling Bock Beer will be offered in 1/2 barrels only, beginning in late February and lasting for approximately 8-10 weeks. Let's all raise a pint of Yuengling Bock and celebrate the 180th Anniversary year!"
5251,1090,Abbey IPA,5,72,Other Belgian-Style Ales,7,"Belgian IPA, West Coast hops meet belgian yeast. Spicy, fruity and citrusy notes combine for an interesting fusion brew."
5252,1090,Barristers Bitter,1,5,Extra Special Bitter,4,Low in alcohol but big in flavor. This beer is dry hopped like an IPA but the alcohol and bitterness have been reduced for a great session beer.
5253,1090,Sacramento Bock,7,90,Traditional German-Style Bock,6.5,A stronger German lager brewed with lots and lots of Munich malt for a toasty bready like aroma.
5254,1090,Brewhouse Lager,8,95,American-Style Lager,4.5,A light all malt lager with delicate hop finish.
5255,1090,Sacramento Nut Brown Ale,3,38,American-Style Brown Ale,5.400000095,A malty dark ale wtih ale with a chocolate and biscuit like flavor and balanced finish.
5256,1245,Hellsmoke Porter,2,25,Porter,5.699999809,"A roasty robust porter. 
Brewed with malt that I smoke over alder and apple wood. 

Goes great with steak, burgers, 
as well as barbecued, grilled, or smoked food. 
Kielbasi! 

Cheeses? 
Try it with Gouda, Brie, Swiss, or Havarti."
5257,1245,Wheatley Hills Weizenbock,4,50,South German-Style Hefeweizen,7.5,"Malty and yeasty, with some sweetness along with hints of cloves and banana. (thanks to the yeast!) 

Low hop bitterness, highly carbonated. Unfiltered, and so a bit cloudy with that magical yeast. 

Pairs well with Thai, Szechuan, Mexican, and Caribbean -- und Deutsche Nahrung! (German Food!)"
5258,1245,Long Island Potato Stout,3,42,American-Style Stout,3.900000095,"Brewed with real mashed Long Island Potatoes (or is it ""Potatos""?) in the mash - hence, ""twice mashed."" 

I'll admit, my Polish, Irish, and German heritage finds the siren song of potatoes irresistible. (My French blood, not so much.) The local, Long Island agriculture booster in me needs to go for the Long Island potato above all others. 

With a brewery this small (basically a home brewery with a license to sell), I can brew what ""gets"" me, with hopes that some folks will enjoy it."
5259,1245,Old Walt Smoked Wit,5,67,Belgian-Style White,5,"A smoked wit, you say? 
Yup. 

Researching smoked beers led me to a world of smoked wheat beers, particularly a smoked wheat beer popular in Poland about 100 years ago. (I'll list that one as one of the Blind Bat beers when I'm happy with the test batches and am ready to offer it to the public.) I didn't find anything about smoked wit beers, but decided to experiment a bit (a wit is a wheat beer). I like it, and hope you will too. 

Pictured on the label is Long Island's old Walt Whitman, enjoying a smoke and a book in what is purported to be his favorite spot in his native West Hills. Long Island's springtime is awakening all around him."
5260,1245,Harborfields HefeWeizen,4,50,South German-Style Hefeweizen,4.5,"Sometimes it's good to keep it simple. 

Harborfields HefeWeizen is modeled after the German classic, but meant to be available fresh (like you would enjoy if you were in Germany). Shipping over long distances is not always a friend to beer. 

Named for the Centerport-Greenlawn area of Long Island that is home to the Blind Bat Brewery, Harborfields Hefeweizen goes great with fish, chicken, or a summer salad. Some even like it with brunch! (Please enjoy your waffles responsibly.)"
5261,157,Samuel Adams Imperial Stout,3,43,American-Style Imperial Stout,9.199999809,"Samuel Adams Imperial Stout is our take on the stouts brewed by 18th century English brewers for the Russian Imperial Court of Catherine II. The special malted barley in this intense and massive brew delivers rich flavours like dark chocolate, coffee and anise."
5262,157,Samuel Adams Imperial White,5,67,Belgian-Style White,10.30000019,"Samuel Adams Imperial White is a new perspective on the classic witbier style.  Witbiers are normally light and refreshing with a fruity finish and we wanted to see how these characteristics would stand up when we amped up the recipe.  We were totally blown away by the flavors that were created by this beer.

This is not just a more intense version of our spring seasonal Samuel Adams White Ale.  Imperial White is a new recipe that stands on it own merits.  In fact, it is more of a wine substitute than just another refreshing witbier.  This is a beer that should be sipped and savored and you"
5263,678,HUB Lager,7,77,German-Style Pilsener,5.099999905,Our Czech style pilsner is all malt all the time-no choicest rice or corn syrup here! Whole flower Czech Saaz hops balance the delicate honey flavor of our organic Canadian grown pilsner malt creating a golden beer with depth of character.
5264,678,Hopworks IPA,3,31,American-Style India Pale Ale,6.599999905,"Our namesake IPA is a Northwest classic. Generous additions of Amarillo, Centennial, and Ahtanum hops find their way into the kettle, hop-back, and dry-hop. This judicious use of the ""brewers spice"" creates rich and resinous flavors of citrus fruit and pine. The finest organic Canadian pilsner malt and organic German Munich and Caramunich malts then bring balance to your new favorite beer."
5265,678,Velvet ESB,1,5,Extra Special Bitter,5.199999809,This English Session Beer has a delicious floral hop aroma and flavor. A heaping helping of organic caramel malt and touch of organic chocolate malt give this beer its beautiful mahogany color while organic oats from Bob's Red Mill velvetize the texture. Smoother than an infomertial host at half the price!
5266,678,Crosstown Pale Ale,3,26,American-Style Pale Ale,5.300000191,"This beer bridges east and west with a lane dedicated to riders who aren't afraid to get dirty. Three kinds of organic caramel malts and a 24 pound whirlpool hop bomb keep things interesting while the wheels go round and round. Cheers to narrow knobbies, kazoos, and more cowbell!"
5267,678,Deluxe Organic Ale,3,30,American-Style Strong Pale Ale,6.900000095,"""Strong like bull but sweet like your momma. This unique beer is a trifecta of bold flavors. Hops, malt and alcohol bully the taste buds on the organic playground while the monitor blows the whistle!"""
5268,678,Survival Stout,1,21,Oatmeal Stout,5.300000191,"Beer of the Ancients! Barley (Egyptian), Wheat (Mesopotamian), Oats (Egyptian), Amaranth (Aztec), Quinoa (Incan), Spelt (Mesopotamian), and Kamut (Egyptian) sustain the soul with a nutrients cultivated through the millennia. Finished with 15 pounds of cold-pressed Stumptown Hairbender espresso. Unlock the mystery entombed in darkness."
5269,778,Hop Juice Double IPA,3,32,Imperial or Double India Pale Ale,9.399999619,"Here at Left Coast Brewing Co. we pride ourselves on being one of the first breweries to pioneer a Double IPA style beer. In 2003, we brewed our first Double IPA, and haven't looked back since. This hop monster uses Premium American 2- Row and a touch of light crystal malt to create a solid malt foundation. The recipe calls for hops to be used in every step of the brewing process; in the mash, in a hop back, in the fermenter, and in the bright tanks. We use hop extract, hop pellets and hop flowers, hence the name Hop Juice. Hop Juice spends more than 4 weeks dry hopping in the fermenter and the bright beer tank. It is approximately 9.4% abv and has massive IBUs. Hop usage is over 4lbs per barrel. Hopeheads, step up to the plate!"
5270,509,Renegade IPA,3,31,American-Style India Pale Ale,5.800000191,Our award-winning India Pale Ale  is a hop lover's dream. We use Galena and Cascade hops in the kettle and dry-hop with more cascade during conditioning. This copper-colored ale has a nice maltiness to balance all the hops.
5271,509,Long's Peak Raspberry Wheat,11,121,Fruit Beer,4.199999809,This is one of our most popular beers. It is a light and refreshing raspberry-flavored wheat ale.  We use pure raspberry extract to give this beer its fruity aroma and flavor.
5272,509,Stinger Wild Honey Wheat,11,116,Light American Wheat Ale or Lager,6,We put close to a half a pound of Colorado honey per case in this wheat ale. The honey adds a sweetness and raises the alcohol content slightly. We use Mount hood and hallertau hops.
5273,509,Estes Park Porter,2,25,Porter,4.599999905,"Porters are dark ales without the roasted malt character of a stout. Our porter is a brown porter with a very smooth, balanced profile."
5274,509,Estes Park Gold,3,37,Golden or Blonde Ale,4.199999809,"This is our smooth golden ale. Our Gold has a medium body and low to medium hop bitterness 
and aroma."
5275,509,Samson Stout,3,42,American-Style Stout,5,Our commemorative ale honors Samson the elk. This is an oatmeal stout that is full-bodied with a wonderful roasted flavor and just a touch of sweetness.
5276,509,Trail Ridge Red,3,33,American-Style Amber/Red Ale,4.5,Our red is a special bitter. This means it has medium body and mild bitterness. These balance well with the rich copper color. We use American hops.
5277,260,Border Gold Oranic Ale,3,37,Golden or Blonde Ale,6,"According to legend, gold panned from the crystal clear Border streams of the Yarrow valley, nearby the site of the Broughton Ales brewery, was used to make the third wedding ring of Mary Queen of Scots.
 
This golden coloured ale is brewed with a skilful blend of organically grown hops and malt, and pure Scottish water to the exacting standards required by Soil Association Certification Ltd. of the United Kingdom.

The end result is a light golden coloured, clean tasting beer with an excellent hop aroma and aftertaste.

At 6.0% ABV a premium ale for those who know and care about what they eat and drink.

Border Gold has won several awards, the most recent being a bronze medal in the International Brewing Awards in Munich 2005."
5278,1286,Flying Mouflan,3,35,American-Style Barley Wine Ale,9.300000191,This strong alluring ale is two beers in one. Cracking open a fresh bottle unleashes hops and heat with more than 100 IBUs emanating from three hop varieties and sweet burn of 9.3% ABV. Cellaring the Flying Mouflan in a cool dark place at 50 degrees for a minimum of four months will mellow out the hops and wash away the heat. If you can resist temptation you will be rewarded with two memorable beers in a single bottle.
5279,797,Live Oak Hefeweizen,4,50,South German-Style Hefeweizen,0,"Modeled after the classic wheat beers of Bavaria, our HefeWeizen has a cloudy, straw-colored appearance with a thick, creamy head. It is fermented with an authentic Weizenbier yeast strain which imparts delicate notes of clove, vanilla and banana which harmonize perfectly with its mild refreshing tartness. Together these flavors create the perfect thirst quencher to beat the Texas heat. Available April - August"
5280,797,Live Oak Pilz,7,77,German-Style Pilsener,0,"Crisp, clean, and refreshing, this pilsner is styled after the original Bohemian classic from the town of Pizen, Czech Republic, Pilz is a golden-colored brew that balances a pleasant hoppiness with its smooth malt flavor. It finishes dry with a moderate bitterness that is a hallmark of the style."
