id,brewery_id,name,cat_id,style_id,style_id_II,abv,descript
4612,512,Roggen Bock,7,90,Traditional German-Style Bock,5.5,"Brewed in the tradition of great German Bock beers with only German malts and hops, using 20% rye, malt to give it a distinctive spicy, yet smooth character. You'll love the rich flavors and deep red color of this unique German Brew."
4614,512,Saranac Nut Brown Ale,3,38,American-Style Brown Ale,5.400000095,"Saranac Nut Brown Ale's soft mellow malt character is rich and smooth with a medium body. Look for hints of toasted malt flavor, slight hop bitterness and amber brown color."
4615,512,Saranac Mocha Stout,3,42,American-Style Stout,5,"Combines the rich roasted flavor of our traditional stout with a deep, robust mocha. Look for a full-bodied taste with a crescendo of complex flavor notes."
4616,512,Saranac Single Malt,1,15,Scotch Ale,5.5,We use 100% Scottish Maris Otter Malt. Traditionally used in the distilling industry. The combination of the Scottish Malt and slow aging process produces a unique brew as distinctive as single malt whiskey with a flavor than any other beer.
4617,512,Saranac Belgian Ale,5,72,Other Belgian-Style Ales,5.900000095,"Saranac Belgian Ale is Deliciously Fruity. It is brewed with a generous amount of Belgian Aromatic Malt, Hand selected hops, and a traditional Belgian ale yeast. Brewed in the ""Trappist Style""."
4618,512,Saranac Mountain Ale,11,121,Fruit Beer,5,"This Delicious Fruity ale is brewed with blackberries, raspberries and sweetened with a touch of blueberry honey. Light and refreshing.With a reddish-Amber color, be sure to look for the ale bitter and berry sweetness. Enjoy!"
4620,512,Saranac Bock,7,90,Traditional German-Style Bock,6,Bock is not from the bottom of the barrel! It is a rich malty beer brewed with traditional German ingredients and aged for months to give it a smooth malty character. Look for a rich full-bodied beer.
4622,512,Saranac Extra Special Bitter,1,5,Extra Special Bitter,5.5,"Bitters are popular pub beers in England and are closely related to the more well known pales ales. Saranac Extra Special Bitter has a rich, malty taste balanced by the pleasant bitterness of Williamette Hops. The finish is dry with a hint of the Foral English Fuggle and Spicy Saaz hop. Enjoy!"
4623,512,Saranac Imperial IPA,3,32,Imperial or Double India Pale Ale,8.5,"Saranac Imperial IPA is part our new High Peak Series, a line of beers that are bigger, more complex and flavorful; beers that are meant to be sipped and savored. Saranac Imperial IPA is brewed with 10 different malts and 10 different hops to make a delectably flavorful and complex Imperial IPA - at 85 IBU's and 8.5 % alc/vol."
4624,512,Saranac Imperial Stout,3,43,American-Style Imperial Stout,9,"Saranac Imperial Stout is part of our ""High Peaks Series,"" a line of beers that are bigger, more complex and flavorful; beers that are meant to be sipped and savored. Saranac Imperial Stout is brewed with 11 malts to balance a deliciouse chocolate and coffee roasted flavor with a spicy herbal character of the generous kettle and dry hops."
4625,512,Saranac Scotch Ale,1,15,Scotch Ale,6,"This Scotch Ale is a full-bodied, malty sweet ale. True to Scottish brewing tradition, this malty flavor and deep copper brown color are a result of Scottish two row malt and roasted barley."
4626,674,Stony Face Red Ale,3,33,American-Style Amber/Red Ale,5.599999905,"Hoppy's gift to those who like their beers Malty. Dark Caramel and Chocolate Malts lend their deep crimson silkiness, and judicious additions of Nugget and Cascade hops give just enough bitterness for balance. Ask your server's favorite beer and it's probably this one."
4627,538,Humbles Blond Ale,3,37,Golden or Blonde Ale,3.5,"Our lightest beer in body and color, Humbles has proven to be our most popular offering."
4628,538,Heat Seeker Hefe,4,50,South German-Style Hefeweizen,4,"A Bavarian style Hefeweizen, a cloudy brew with slight hints of bannana and clove.  Light and refreshing."
4629,538,Catalina Common Lager,8,95,American-Style Lager,4,"This copper colored lager is brewed with hybrid yeast that ferments at warmer temps, giving that clean refreshing taste of a lager with the slight fruitiness of an ale."
4630,538,Spitfire Best Bitter,1,3,Ordinary Bitter,4,"An English style ale, copper in color with subtle English malt hints balanced nicely with fresh Washington grown Yakima Valley hops."
4631,538,Afterburner IPA,3,31,American-Style India Pale Ale,6,"A hop lover's delight!  Our I.P.A. is loaded with Ahtanum, Tohmahawk, Palisade, East Kent, Goldings and finished with the ever popular Cascades, balanced with generous amounts of floor malted crisp Maris Otter barley."
4632,441,Hop Henge Imperial IPA,3,32,Imperial or Double India Pale Ale,8.75,"HOP HENGE IMPERIAL IPA -  The Ultimate in Hop Innovation 

Hop Henge Imperial IPA returns to the Bond Street Series line-up this April in extreme fashion. Staying true to the experimental nature of the series and the 'never settle' philosophy of Deschutes, our brewers went back to the drawing board to create an amplified version of last year's monument to hops.

Head Brewer Brett Porter says, 'This is a truly exciting and groundbreaking beer. We reformulated everything about the hop recipe to give Hop Henge an extraordinary aroma and flavor similar to a fresh hop beer.' In addition to the Cascade and Centennial hops, Deschutes Brewery is experimenting with a hop variety so new that it has yet to be named.

The team here at Bend Public House recommends Hop Henge as the perfect accompaniment for a variety of spicy foods, so be sure to have a bottle handy next time you make a batch of hot wings and go for the five alarm award. The high-octane hoppiness is a wildly refreshing antidote to a wide array of hot foods.

Limited Availability April through June.

Don't miss this amazing hop experiment that is sure to leave your taste buds begging for more.

-http://www.deschutesbrewery.com/Brews/Bond+Street+Series/default.aspx

Available April through June.

Hop Henge I.P.A. was first brewed in 2006 as an agressive West Coast style I.P.A. In 2007, Hop Henge is going Imperial!  Several pounds of  Centennial, Cascade and Northern Brewer hops are in each barrel with a heavy dry-hop presence to top it off.  A blend of crystal, pale and caraston malts creates an overall biscuity characteristic that is dense and muscular, building the alcohol base to support the monstrous hop profile.

Like the rest of the Bond Street Series, Hop Henge highlights the creativity and curiosity of our brewers.  Bolder than its English ancestors, with huge hops and a bitter finish, this IPA is no wallflower.

Alcohol By Volume: 8.1%
	

IBU 95

When one of our brewers suggested we name our new IPA Hop Henge, he also came up with the idea of actually recreating Stonehenge, only with hop bales.  We were up for the challenge and even though the weather did not want to cooperate, we pulled it off and threw a party afterwards.
	


photo: chris mather
Ratings, Awards & Notables

World's Best Strong Pale Ale (Imperial IPA)
2007 World Beer Awards

World's 50 Best Beers
2006 International Beer Challenge

Gold Medal, 92 Points
2006 World Beer Championships

Silver Medal, India Pale Ale Category
2006 Australian International Beer Awards

Modern Brewery Age, February 12, 2007
5 out 5 stars 
Hop Henge started its life as an India Pale Ale, but this year it was bumped up to 'Imperial IPA' status, with a hefty dose of additional hops.
'This one is lovely,' said taster Tom Conti. 'They got it just right.'
It pours out a deep amber, with an appealing rocky head, and rich hop aroma wafting from the glass. 'They sure dosed it with a lot of hops...[there's] a lot of hop bitterness in the taste,' one taster observed.
In addition to the Imperial-level hopping, Hop Henge also boasts Imperial-level alcohol content, with 8.1% a.b.v.
This was the top-rated beer during its tasting session, and tasters had to dig deep for new superlatives to describe it. 'This is a beautiful beer,' concluded taster Gregg Glaser. 'Full of flavor and hops and malt and hops again.'
'Not for the timid,' said taster Robert Lachman.

-http://www.deschutesbrewery.com/BrewPub/OnTap/125352.aspx"
4633,538,First Flight Amber Ale,3,33,American-Style Amber/Red Ale,4.5,Our first beer brewed right here at Flyers.  This ale has brownish red hues with a mild maltiness balanced by an herbal hop character without being bitter.
4634,538,Barnstormer Brown Ale,3,38,American-Style Brown Ale,5,"As the name implies, a rich deep brown ale in color with dark amber highlights.  The flavor is slightly sweet with hints of nuts and toffee finishing smooth with no after taste."
4635,538,Peacemaker Porter,2,25,Porter,5.5,"A robust porter in style, a dark and full bodied ale with hints of roasted barley and flavors of coffee and bitter sweet chocolate on the palate."
4636,538,Sick Duck Imperial Stout,3,43,American-Style Imperial Stout,10,"A rich and very dark Imperial Stout that has a complex flavor profile with hints of molasses and caramel.  Brewed in July to allow time for aging, Sick Duck finishes very smooth for such a big beer."
4639,314,Bube's Red Ale,3,33,American-Style Amber/Red Ale,0,This was the first draught on tap in November 2001. It has developed to a very quaffable ale. the slight sweet malt flavor is balanced with East Kent Golding hops to produce this delicious reddish-amber ale.
4640,314,Bube's Stout,3,42,American-Style Stout,0,This dark full bodied stout is perfect with a meal or as a meal. Rolled oats give this beer an enjoyable mouthfeel while chocolate and roasted malts lend to its distinctive flavor.
4641,314,Bube's Kiwi-Strawberry Wheat,11,121,Fruit Beer,0,The perfect thirst quenching summertime ale. The subtle flavor of kiwi and strawberry blend with traditional German wheat and hops. Great for a hot summer day.
4642,314,Bube's Brown Ale,3,38,American-Style Brown Ale,0,"Another one of our first recipes, which we have improved with experience. This ale is pleasantly malty with nutty and toffee like undertones. East Kent Golding hops were used to compliment this English style ale."
4643,314,Bube's Hefeweizen,4,50,South German-Style Hefeweizen,0,"This traditional German-style wheat beer is rich in banana and clove undertones, with a wonderful frothy head."
4644,314,Bube's India Pale Ale (IPA),3,31,American-Style India Pale Ale,0,"Bube's rendition of this classic style is made with fine 2-row malted barley and West Coast hops. A wonderful malt finish with a delicate citrus aroma, reminiscent of its Old-World cousin."
4645,1286,Scratch #7 2008,4,55,South German-Style Weizenbock,7.900000095,"Red and white wheat combined with darker malts add body to this hazy, unfiltered ale.  Fermented with the same yeast as DreamWeaver Wheat replicating the pepper, clove and all-spice flavors found in our year-round beer."
4646,1286,Scratch #11 2008,1,3,Ordinary Bitter,4.900000095,"Next up, we present Scratch Beer #11-2008, a Bitter. Back in the day, we used to brew a little number called Troegs ESB. Even though this beer was retired almost six years ago, we still get numerous Troegs old-schoolers (Martha) begging for its return.

Well hang onto your boot straps because Scratch #11 is about as close as we can get to the original ESB without firing up the old brew kettle. The Scratch #11 recipe originates from Chris' stint at England's University of Sunderland brewing program. After returning to Colorado the brothers drew on Chris' experience and brewed pilot batches tweaking that recipe. The ESB production recipe has direct bloodlines to these pilot batches.

The Thames Valley ale yeast and the roasted barley create a biscuit flavor with nutty undertones. Combining these flavors with the earthiness of East Kent Golding hops creates one hell of a fine session beer. Take in the deep mahogany beauty of this beer and breathe in the full hoppy nose. It's not the ESB, but it's damn special."
4647,1286,Scratch #10 2008,5,61,Belgian-Style Tripel,10.19999981,"he third time just might be the charm-Scratch #10-2008 is our third triple in the Scratch Beer series.

This grand cru has been lovingly aged since late-February, yet still unleashes the slightest hint of alcohol heat.

Scratch #10-2008 also has a triple flavor inspiration combining the caramel/toffee notes of dememera sugar and molasses, with citrus and licorice flavors created by the orange peel and star anise; lastly we create a peppery/spicy finish with the same trappist yeast has been used in each Scratch Beer Triple."
4648,1286,Scratch #8 2008,5,61,Belgian-Style Tripel,10.10000038,"Revisiting Scratch #3, we take the same Tripel recipe, add beet and cane sugars to the kettle, and run the wort through our hopback brimming with juniper berries, coriander and yarrow flowers.

Inspired by the herbaceous nose of gin, the berries and flowers give a slight pine/citrus aroma with floral undertones. Scratch #8 has a dry, yeasty finish and noticeable alcohol warming when consumed."
4649,1286,Scratch #6 2007,8,95,American-Style Lager,5.099999905,"Old world brewing techniques combine with Noble hops for Scratch #6-2007.
This Export Lager features a single stage decoction-a first for Troegs Brewery. After combining barley and water we transfer a portion of the mash to the brew kettle for a quick boil. The heated mash is then returned to the mash kettle and the brewing process continues. This process deepens the malt character and adds a subtle toffee backbone to this delicious lager.

We've added Magnum hops for bittering and Czech Saaz hops for aroma to create a classic European Noble hop flavor. 

Scratch #6-2007 is unfiltered, so there will be a slight haze to the beer."
4653,1204,Oaked Arrogant Bastard Ale,3,30,American-Style Strong Pale Ale,7.199999809,Arrogant Bastard Ale aged in oak barrels.
4654,460,Hansa Imported Dortmunder,8,95,American-Style Lager,4.800000191,Surviving beer from the Dortmunder Hansa-Brauerei before being acquired by Actien.
4655,90,Hoppy Hefe,4,50,South German-Style Hefeweizen,0,It is a nice example of a Hefeweizen.
4656,90,Bourbon Barrel Smoked Porter,2,25,Porter,0,"Think of Guinness but with a ""smooth bite"" to it. This is a wonder beer for those of us who enjoy a porter."
4658,90,Cask Hefe,4,50,South German-Style Hefeweizen,0,It is a good clean hefe.
4659,459,Raison D'Etre,3,29,Dark American-Belgo-Style Ale,8,"A deep, mahogany ale brewed with beet sugar, green raisins, and Belgian-style yeast. As complex as a fine, red wine. Voted ""American Beer of the Year"" in January 2000 by Malt Advocate Magazine."
4660,459,Fort,11,121,Fruit Beer,18,A strong ale brewed with a ridiculous amount of pureed raspberries (over a ton of em!).
4661,459,Lawnmower,3,26,American-Style Pale Ale,4,"Lawnmower is our intro for those who need a little help jumping feet first into the crazy world that is Dogfish Head beer.

It's a starter beer, but it's not dumbed down. Lawnmower is made with quality ingredients and is a great thirst quencher - perfect to enjoy after a day in the sun mowing the lawn (or anything else that gets you hot and bothered)!

Draft-Only, Limited Distribution"
4663,459,Black & Blue,11,121,Fruit Beer,10,A belgian-style Strong ale fermented with blackberries and blueberries.
4664,459,Red & White,5,67,Belgian-Style White,10,"A big, belgian-style Wit brewed with coriander and orange peel and fermented with Pinot Noir juice. After fermentation a fraction of the batch is aged in Oregon Pinot Noir barrels, and another fraction is aged on oak staves. The beer is blended together before packaging.

This has been one of our most popular Limited Edition beers at both our Rehoboth Beach, DE brewpub and at festivals. It successfully marries the refreshing citrusy qualities of a Belgian-style white beer with the robust complexity of a bold red wine."
4665,459,Aprihop,11,121,Fruit Beer,7,"Brewed with luscious apricots, finished with whole-leaf hops. A ""fruit beer for hop heads..."" Ale Street News"
4668,741,Kirin Light,8,96,American-Style Light Lager,3.309999943,"From Kirin's Site:

With just 95 calories and full-flavor, Kirin Light is one of the few great world-class Lights.

You might think Kirin Light would be a lightweight contender, content to let his sturdier siblings steal the show. But this fitness-minded newcomer won't compromise. You won't have to compromise either - with just 95 calories and full flavor, Kirin Light is one of the few great world-class lights.

What makes Kirin Light great
Canadian barley malt, Czech hops, rich golden color"
4669,459,Chateau Jiahu,11,126,Herb and Spice Beer,9.5,"9000 year old Chateau Jiahu stands apart as the most ancient, chemically-attested alcoholic beverage in the world. Its recreation is based on painstaking excavation by Chinese archaeologists of Jiahuin the Yellow River basin, state-of-the-art microanalysis of pottery residues by American laboratories, and the inspired ""Neolithic"" brewing of Dogfish Head Craft Brewery. Chateau Jiahu, then as now, opens a window into the world of our ancestors."
4670,1248,Pipe Organ Pale Ale,3,26,American-Style Pale Ale,4.900000095,"When the British introduced draught pale ale to America, the Pipe Organ Pale Ale is what they had intended. It is truly British in character. Brewed with pale ale malt and a touch of caramel malt, it has a light copper color and subtle body. The maltiness is carefully balanced with only the best English hops - East Kent Goldings. Although this beer has a fair amount of hops, the caramel maltiness perfectly balances its profile."
4672,1248,Millennium Trippel,5,61,Belgian-Style Tripel,9,A Belgian Trippel is a very special type of beer. A Belgian Trippel could be called the beer version of a Champagne. It is very light in color and highly carbonated giving an appearance similar to Champagne. The flavor is somewhat sweet and malty as well as strong.
4673,1248,Celestial Gold,7,77,German-Style Pilsener,4.099999905,"This beer is golden in color with a light bubbly effervescence. The light body makes this lager beer appropriate for a business lunch or your evening sipping beer. The light malt flavor also accentuates the hop flavor. From the start, you will notice a fine hop aroma. As you sip the Celestial Gold, the subdued maltiness blends with a slight hop flavor. When this beer finishes, you will notice a pleasant hop bitterness. The bitterness will be mild and quite appropriate. Celestial Gold has been known to induce Celestial bliss."
4674,1248,Blast Furnace Oatmeal Stout,1,21,Oatmeal Stout,4.800000191,"Stouts have typically been a staple beverage in the UK.  There are many variations of stouts available. You can find dry stouts, milk stouts, Imperial stouts, American stouts, and even stouts made with oats.

At the Church Brew Works we have crafted delicious Toasted Oatmeal Stout.  The oats were blended with the best barley malt we have -  and we didn't stop there.  To give this beer a wonderful roasted flavor, we added unmalted, very darkly roasted barley.  The roasted barley is mixed with a generous portion of chocolate colored malt giving the Blast Furnace Stout a beautiful ruby hue.

We used our finest hops unsparingly to create a delicately balanced bitterness with a rich roastiness and fresh hop aroma. The Fuggles and East Kent Goldings hops were added with heavy hands at two different times.  This unbridled addition grants a full hop flavor to our heavenly drink.

A typical oatmeal stout is a bit lower in alcohol than most other stouts as does the Blast Furnace Stout.  Ours, though not typical, does have a welcome medium body.  As you drink this beer, notice the rich, creamy brown head.  Drink it slowly and savor the flavors.  We don't think you will be disappointed.  Beer is not just for breakfast anymore."
4675,1248,Church Brew Oktoberfest,7,84,German-Style Oktoberfest,5.199999809,Our Oktoberfest is a light amber colored beer.  It is malty in both flavor and aroma making it a delicate beer which is very drinkable. The hop bitterness is kept low to accentuate the maltiness.  Notice the crisp clean character and enjoy.  We brewed three batches of this beer so that we can bottle some of it in order to enhance our bottle beer selection.
4676,1248,Mad Brewer Maibock,7,91,German-Style Heller Bock/Maibock,7,"A bock beer is required by German law to start at 17 Plato.   For those who are interested,  Plato is a measurement of the sugar content before fermentation.  It is a very malty lager beer with medium hop bitterness.  A maibock is a light to amber colored bock beer.  A Maibock is very similar to a Helles/pale bock.  Maibocks were originally brewed for the coming of spring, hence the name Mai (German for May).  The Mad Brewer Maibock is medium amber in color.  Though similar in color to our Pipe Organ Pale Ale, it is very different in character.  Don't let it get you though, it's a very strong beer at about 7% alcohol. It has a very clean and malty nose.  The hop bitterness is evident, but not dominant.  The Mad Brewer Maibock will finish quite full and have a delicate sweetness."
4677,1248,Heavenly Hefeweizen,4,50,South German-Style Hefeweizen,4.5,"I'm sure everyone here knows, Pittsburgh has some humid summers.  What can you do to escape the heat and enjoy yourself?  Well I've got the answer.  How about a light thirst quenching Hefe Weizen (pronounced hefa Vite zen) in the cool environment of our Hop Garden patio.  I can hear you wondering, what is a hefe weizen?  Allay your fears my friends because I'm going to tell you.  A hefe weizen is a special style of beer made with malted wheat and malted barley.  Hefe weizens are from Germany.  This beer is top fermented (an ale) with a very special yeast.  The Hop levels are kept deliberately low in order to bring out the character of the yeast.  If you notice the nose of the beer, it has a clove-like or fruity aroma.  The grain bill includes 50% wheat malt and 50% barley malt.  It is served very carbonated and a touch cloudy.  It is cloudy because it is served unfiltered.  The remaining yeast contributes flavor, adds B vitamins, and improves the beer as it ages."
4678,1286,Scratch #12 2008,3,31,American-Style India Pale Ale,6.5,"In our never-ending pursuit of answering the burning question of what's new, we present Scratch #12-2008, an IPA.
 
The IPA is a fickle beast; too much malt and you veer into a high-octane hopbomb, while too little hops can question a beer's virility. In these chaotic days of shrinking hop harvests, balance is key to a proper IPA. Scratch #12-2008 delivers an intense pine nose married with a subtle wildflower aroma. The Thames Valley yeast adds an earthy nod to traditional English IPAs, while the American hops provide a bold contrasting bitterness.
 
Breath deep, relax, enjoy."
4679,690,Jupiler,7,77,German-Style Pilsener,5.199999809,"Jupiler is the most famous and most popular beer in Belgium. This delicious lager is brewed with the finest ingredients (malt, maize, water, hop, yeast), using undisputed craftsmanship, ensuring an outstanding beer quality. Jupiler offers refreshment on a wide variety of occasions, thanks to its digestibility and accessible taste. Jupiler (5,2 % ABV) is ideally served at a temperature of 3 C. The low-alcoholic variant Jupiler N.A. (0.5%) should be served at 1-2 C.

Jupiler has an outspoken image of masculinity, courage and adventure. Furthermore, Jupiler understands men like no other brand and shares their best moments. This combination of male bonding, self-confidence and self-relativation, speaks to all men and makes Jupiler an ally on their road through life.

Jupiler is the official sponsor of the highest Belgian football division, the Jupiler League, and also supports the Belgian national football team. Just like football, Jupiler is all about competence and ruggedness, effort and effort reward, team spirit and... festivity!"
4680,263,Trappist Westvleteren 12,5,62,Belgian-Style Quadrupel,11.19999981,This Belgian beer has an everlasting tast.  It has been choosen as the best beer in the world for several years!
4682,1013,Kate The Great Russian Imperial Stout,3,43,American-Style Imperial Stout,9.5,The granddaddy of stouts.  Intended for export to the Imerial Court of Russia's Catherine the Great.  Jet black.  Full-bodied.  Very strong.
4683,1260,Dark Lord Russian Imperial Stout,3,43,American-Style Imperial Stout,13,"Gargantuan Russian Stout brewed with coffee, molasses, and honey."
4684,1244,Light Weight,3,37,Golden or Blonde Ale,4.329999924,"Our lightest beer, and our Bronze Medal Winner 2006 World Beer Cup German pilsner malt and American hops give this brew a light, crisp finish. Made with the light beer drinker in mind."
4685,1244,Donovan's Red,3,33,American-Style Amber/Red Ale,5.159999847,"Named after Donovan's, a 19th century Irish restaurant in downtown Waterbury. This medium-bodied, red-colored ale has a nice hop flavor and aroma."
4686,1244,Pappy's Porter,2,25,Porter,5.420000076,"This dark mahogany ale has agreat and delicious malt depth, yet is balanced with supple, energizing bitterness."
4687,1244,Holy Cow IPA,3,31,American-Style India Pale Ale,5.159999847,For hops lovers - this bitter ale is pale colored and made with a blend of 6 different malts and 5 different hops. This ale is dry-hopped for extra flavor and aroma.
4689,1244,Broken Spoke,3,26,American-Style Pale Ale,5,An American pale ale made entirely with amarillo hops.
4690,1244,El Jefe,3,31,American-Style India Pale Ale,5.699999809,"Our holiday ale. This I.D.A., India Dark Ale, is crisp, bitter and overflowing with the aroma of spruce. Perfect for the holidays."
4691,1244,Heady Topper,3,32,Imperial or Double India Pale Ale,8,"Is our double I.P.A.! Loaded with hops, this one will put hair on your chest."
4692,1244,Heathen,3,31,American-Style India Pale Ale,6.900000095,An american IPA brewed with a blend of 3 base malts and a multitude of hops.
